review_id,sentence,sentimentg-ghJX-ji2lFFsNGnqTPqA,"Primantis is the ideal Pittsburgh sandwich. Fries, coleslaw, provolone, whatever meat you'd like in between the famous mancinis bread. I love this location especially because of the hours. Living downtown it's hard to find places to eat late at night but the market Sqaure primantis is open till 12 o'clock 7 days a week. I've tried variations of the sandwich but my favorite so far is the pastrami. I went tonight and I'll be back again the near future.",PositiveSpqxt8AF0wnnodXB4YPZDQ,"Got a sandwich to go so I can't give a full review but when I ate it, the fries were soggy and SOO greasy.  I had the bag in my purse and the grease leaked through and eventually broke the bag.  Really want to eat in there next time since everyones sandwiches looked yummy.

Their vegetable soup was great!  The people who work there are the best.  Amazing service.",ObjectiverD6VG6zs3Ehy2oXoGeweFw,"Not sure that I could eat here more than once every 10 years, but I'll take my chances. I suppose it helps that my doctor's office is 2,500 miles away and the chances are slim that I'll run into him here.",Positive9KoWLpIKAPiuGmI1g2celA,"I heard this place stacks fries and cole slaw onto your sandwich so I gotta try it. I ordered the drunk duck drink and it was fantastic. I got to keep the little rubber ducky on top of my drink too :)  As for the sandwich, I got the deluxe double egg and cheese.  The portion was HUGE and very messy!  More messy than boogers coming out from a runny nose.  The sandwich I got was really good and filling.  I would recommend this place for visitors from afar and who happens to be in the neighborhood.",Positivek71-13VoU1Moejb2C6d2jg,"I had lived outside of Pittsburgh for a couple of years and have eaten at this Primanti Brothers location four or five times. Their sandwiches were always tasty, worth the wait and the trouble of finding parking etc. So, when my parents came to visit, and we made a trip out that-a-way, I knew that would be a lunch stop. We ended up coming into Pittsburgh on Sunday around 1pm. I knew it would be crowded and anticipated having a wait. We got a table after 15 to 20 minutes and quickly sat down before someone else did. It took the waitress about 10 minutes to come and clear the previous customers remnants, which was ok. 

We ordered our beers and were told that she'd come back and take our order. She came back 20 minutes later, with the beers and took our order. After that, we sat around and waited for our sandwiches for 35 minutes. When we did finally get our food, it was ice cold. The fries in the sandwich were completely soggy and cold, and the meat was barely warm. Our table ran out of napkins, and we asked for some, but they never came, finally, the table next to ours handed us a few. Maybe it was because it was cold, but the sandwiches weren't that great. I had very little meat in mine, and more coleslaw that anything else. Also, the thickness of the bread seems to have increased since I last ate here because about 60% of my sandwich was bread. We were fairly disgruntled about the whole thing, but were still going to leave a tip for the waitress. 

Then, my dad went to the bar to pay. He stood there for 10 minutes, behind another customer. The server came up to them and said 'what the hell are you doing up here?', in those words!! My dad was so stunned be just stood there, the guy in line ahead of him told her that he was waiting to pay his bill, so she cashed him out and then turned around to do something else, when my dad said 'excuse me, i need to pay too', she replied to him ' Jeez, you guys are so demanding! Why the hell are you in such a hurry"". That is when their tip went straight out the door with us. 

We were ok waiting for a table, we were even ok waiting for our food; it took them one hour from the time we sat down, to the time we got our food, and then the server had the audacity to behave in that manner. Either Primanti Brothers has become too big for their boots and let things slide, or they need to train their staff to be more polite and efficient. We will definitely not be coming back the next time we are in town. Our money is better spent else where.",NegativepyR3rED3FdB_8oNmDJLPWQ,Super friendly staff. Got there in the morning before the lunch rush. He sandwich is huge and delicious.,PositiveM-AcqDwsrBlSAvIQ2qxAHw,"Had such high hopes for this place on our visit to Pittsburgh.  The presentation of the sandwiches were making my mouth water, there's a lot of good things going on in the ingredients...In theory, this should've resulted in a bold flavor taste explosion, but I found myself severely let down by all of the bland ingredients piled high in front of me.  The pastrami was terrible, the coleslaw weak, and the fries were bland, dry, and flavorless.  Still bummed, my guess is that this place I more of a tourist draw now than a legit sandwich shop.",NegativeJ11fat8iM18uIJoR7-eD2A,"Saw this place on TV awhile back and finally made a stop by here on a Sunday when I came from New York to visit my girlfriend who goes to school at Point Park. 

Steelers and Pirates gear on the walls and on the people (Do you Pittsburgh-ers own a Steelers t-shirt for everyday of the week?)

Anyway we were both a little groggy that morning, I plowed into a pastrami sandwich which came on thick cut slices of soft white bread (each slice was probably an inch thick), cheese (white american? provolone? who the hell knows?), sweet (vinegar dressed?) cole slaw, tomato slices, and of course a handful of their fresh cut fries smashed right on top. My girlfriend got the fries w/ chili, cheese, and bacon and they were really good. Wash it all down with some beer. 

Tastes better when watching a NY Giants game!",Positive09Vt2OGb1WQvEI5rvIHFqg,"how can you not be a fan of a huge pile of whatever you ordered with fresh cut fries, tangy coleslaw, cheese, and tomato smooshed between 2 thick slices of fresh italian bread?  if you aren't, there is something seriously wrong with you.  oh, and don't forget to pair it with a yuengling and a whole bunch of the cayenne pepper sauce.  also - make sure to say 'hi' to lefty!  he'll appreciate that.",PositiveCUaio6Fr2fbUCKN1RbIBvA,"Visiting Pittsburgh from out of town, so naturally I asked my hosts to take me to Primanti's (and they were happy to oblige).  We went to the one at ""PPG."" The place was busy but not crowded on a Friday night.  The menu was on the wall along with murals of Pittsburgh's finest sports starts.

Our server was quick and efficient and we never were in need of refills or anything else.

I got the Pitts-burgher cheese steak and we tried an order of the Smallman Street Fries.  The fries were truly loaded.  The chili had a nice kick to it and there was literally an ice cream scoop of sour cream on top.  However, the fries were actually seasoned that well and were under done in my opinion.  That didn't bode well for the fries on the sandwich, but I kept my hopes high.

The sandwich comes out and its a monster.  I love the italian bread, the beef patty and cheese, the slaw was good (shredded cabbage, not like southern cole slaw).  Everything was fresh but, again, the fries were the worst part.  Underdone, underseasoned.  Definitely my least favorite part.

Nonetheless, I would definitely return because I want to try some of the other menu items.  I've heard double-meat is the way to go.  I'm intrigued.",ObjectivepzMLhuw-TeGVIuj5OmoxoA,"Primanti Bros is the dirty guilty pleasure that I give into once a year.

Most times, when out of towners ask for a local spot to eat, I'm one of the few that actually pushes them AWAY from this defacto Burgh tradition.  Don't get me wrong, Primanti's isn't bad, but it isn't exactly great either.  Typically I end up smothering mine in hot sauce and salt/pepper to get some flavor onto otherwise bland sandwiches.

With that said, every once in awhile, I get this odd, insatiable craving for a cap and egg sandwich (w/ onion)... and when I do cave to that temptation, it's oddly satisfying.

On the experience front, Primanti's is definitely one of a kind.  I don't know of anywhere else you can get burly bartenders to slam down a mess of a sandwich in wax paper on your table (something the suburban restaurants fail to provide).  If you're going to go, I highly suggest going either to the original in the Strip, or, if you don't feel like waiting in line during the busy times, the Market Square location.",Objectiveri4UDju9ruTEuoFbYDrIhg,Worst service ever.  The waitress and I use that term loosely rolled her eyes at any question when ordering and yelled at someone at the table for asking for coleslaw on the side.  Then she had to come back and re ask the orders again and got mad when we repeated about the coleslaw since she didn't repeat it back.  When she brought out the food she just slammed the food down and just shouted out the name of one of the sandwiches um are you asking who had which sandwich which is your job to remember anyways.  I'm glad I don't live in Pittsburgh to have to worry about avoiding this place.,NegativeyjFV43oOlE7cVINSrSne6w,"Stopped by two times this weekend as I was in the area again). Get an egg thrown in the mix on your sandwich. Tried the pittsburgher cheesesteak, I was expecting a regular burger patty or sliced steak, ended up being a weird patty almost like a meatloaf (not a burger). Not sure I'd order that again. Pastrami and cheese was still good. Wish the egg came a little runny.",Positive#NAME?,"My partner wanted to try a Pittsburgh cheesesteak sandwich and we read this was the best place to go. I don't like fries and I don't eat cheese, but I still loved my sandwich! I ordered the chicken sans cheese and fries, of course. The cole slaw was very good; I loved that it didn't have mayo in it and the flavor was great. Our waitress recommended that we try their hot sauce on the sandwiches and so glad we did because it really spiced it up and made the sandwich even better. My partner ordered the real deal and said it was delicious as well! We also ordered a ""small"" beer, which is a full 12 oz glass, pretty sweet deal. 

Highly recommend this place",PositivefDQmKF9Dl_Oi3WfUVfi46w,"Can I give this place ZERO stars? They're supposively ""famous"" for their sandwiches so some friends and I go when we are in town. The waitresses all rolled their eyes and glared at me for not wanting my fries on top of my sandwich. (Not to mention the waitress was in the skimpiest tank top with her bra hanging out while waiting on us and grilling food. Gross.) I get that your famous for having fries on the sandwich but regardless, a customer should be able to get what they want. This place was trashy, dirty and probably not even up to code.",NegativejUoKgbYX_8XXPIvLfYJJ8Q,"This spot was the light of my life for about 3 solid weeks. From the first bite I could tell that parting ways with Pittsburgh would be heartbreaking. After driving out of pittsburgh and paying my friend for his leftover half a sandwich, I knew that id made a special connection. To that bacon egg and cheese waiting for me, I miss xou and cant wait to hold xou again.",Positive9xFEwiOnzCyOMqmjTQieQw,Just the same as always! Good and fun! The food shows bring in too many lookie lous that want to order some kind of foo foo salad though........,PositivefgqfXRphNU4SazzHyscMNg,"This is the most overrated place bragged about in Pittsburgh. My first visit was to the one in South Hills. Waited 90 mins for 4 sandwiches. The coleslaw is gross and I'm a fan of coleslaw. Due to the 90 min wait I was given a gift card which I used at the one in Market Square. This time I got the grilled chicken salad. If you like chewing on rubber bands, I recommend it. It was the absolute worst salad I've ever had, how can you screw up a salad? The chicken was tasteless and rubbery. Got it to go and the girl who took the order over the phone was rude and rushed and was equally rude when I picked it up. She assumed she knew my name and my order and handed me a random bag of food. I told her I was missing a sandwich and she tossed another bag at me without saying a word. I will NEVER go back to any of these locations. I'd rather eat a ham sandwich from Sheetz. At least I can get that without an attitude. If you have friends coming to visit from out of town, take them anywhere but here. And for those who say you have to go to the original one in the Strip, no thanks, it's the same food. If you are looking for an awesome sandwich go to Schmitz Old World Deli in Greenfield.",Negativeaw0PRmK2kuB9N187ufOLAQ,"I would give it 3.5 stars. It was a solid sandwich for sure. I got the corned beef which was tasty the only thing I wish they added was some kind of sauce. I'm not sure if that comes on other sandwiches but it could have used some kind of mustard. The price is great too, four sandwiches , two orders of pickles, coleslaw, fries and beer for about 40 bucks. Can't complain about that! 

I would definitely",Objective4qx5rNqOPzlcHYcHloRNFw,In Pittsburgh visiting Carnegie Mellon U and was told we had to come here. I ordered the local famous burger. Can't remember the name but it was really good. The bartender was cool and the atmosphere was dope too. Cool place. I'd spend my money there again.,PositiveIhKbKkMrjFiKvKNQ1V7B1A,What a great place with great eats!  Awesome sandwiches - I had a taste of two sandwiches half a pastrami and a capicola and both were topped off by Coleslaw and French Fries. Which went down nicely with out Iron City beers!,Positivej_0kxt1to312T-u4PEocJQ,"I ordered a fave of diners, the Pittsburger. cheesesteak.  It's a burger with cheese coleslaw, French fries  all piled between 2 thick pieces of bread. Looked ok.  It, however, didn't work for me. 
The coleslaw was great though!!
It's not much of a cheesesteak. It's a weird burger. That burger seemed like a fried frozen burger. Not much cheese either. 
My crew had the kielbasa sandwich and the ham sandwich respectively. They looked great. 
I don't think fries on my sandwich works for me either. I can't hold it against them though. 
I chose poorly. I think they are probably good though. 
My motto: eat food you recognize.",NegativeBh4MM32M_kAPZnH-HLsA2g,Okay so I will forever be a fan and will make this a stop every time I'm in PA! The service was laid back but attentive and that pastrami Sammie fully loaded was utter nirvana :) such a cool staple for Pittsburg and I can't wait to go back!,PositivegmtYIMfjhzkWFU2iBxMZVg,Good place to have a sandwich. Outside tables were a nice place to sit and enjoy the city. Slaw was excellent!,ObjectiveDxzd9LIiny5009dcAMe3Sw,"My brother mentioned that he'd heard about this place in Pittsburgh that puts coleslaw and fries on their sandwiches. Sounded good and I was in town so I thought I'd give it a shot! I went around 4 pm on a Saturday and it was pretty busy! Usually a good sign. There were only about 3 people in front of me in the takeout line, so it shouldn't have taken long for me to place an order, right? Wrong. It took maybe 15-20 minutes for those 3 orders to be taken because nobody would commit themselves to working the register. While waiting in line, I got to see all these mouthwatering sandwiches being made. Once I placed my order, it didn't take long to come out...

So I got a Pittsburgh cheese steak, their #2 most popular item (don't ask what their #1 is...the guy will roll his eyes and unenthusiastically say, ""beer."") Long story short, what I ended up with was a bland, lukewarm beef party with bland soggy fries on top. The cold lettuce and tomato cooled the sandwich even more. I enjoyed the coleslaw on top, which is pretty much all I ended up eating from the sandwich. And a few limp fries. Disappointing.",ObjectivecNQCJBb8rr5NKoAFFPZgCQ,"Had to try this while in Pittsburgh. Ate the first half of my sandwich with the slaw & the fries but by the time I got to the second half I took the fries off because they were cold. I had the pastrami & asked for extra cheese. Didn't get the extra cheese. Feel like the sandwiches are missing something. Might be good with a thousand island dressing or ""secret sauce"". 

Underwhelmed but still recommend trying it at least once for the experience.

Market square location was confusing because seat yourself but wasn't clear.",ObjectiveMfizWOS6VoNOuItGYZpEHA,"AMAZING Sandwich!!   It was a great atmosphere in Market Square in the middle of Pittsburgh.  Nothing fancy, sandwich comes in paper and the drinks are in paper cups but the sandwich's are awesome.  I first saw this restaurant on Man vs Food and it looked great, the restaurant did not  disappoint!",PositiveBiwAhUGuVY35EqWbf4Idmw,"Primanti bros has the best corned beef sandwich in the east, and the coleslaw, fries and tomato right on the sandwich made it totally unique. Oh and they also have a great craft beer selection.",PositiveDlfYqlGOU2-uGfYRIf1w5A,"My Order: Pitts-Burger (ok) & Raspberry Lemon Tea (not bad; sweet) 

Pros: 
- notably, PB was called ""the place"" to go to in Pittsburg
- they put fries & coleslaw into their burgers (novelty idea) due to the history of Pittsburgh (and the working class men) 
- customize-able: you can put eggs, extra meat, etc. in your sandwich
- I sat on the second floor and was able to overlook the first floor & the open-designed kitchen (which was pretty neat) 

Cons:
- to be honest, I didn't think it was anything special. Just fries & coleslaw added into the burger as opposed to being a side
- no parking... 

Nonetheless, it's something worth trying if you're new to Pittsburgh. But would I go back? Probably not.",ObjectiveFVVUDcs0O3dgFX4zvcxOkA,"Alright so being from Texas I'm used to lots of seasoning, lots of flavor, and lots of heat if things are supposed to be spicy.  This sandwich shop lacks all of those things.  This was my first shot at local food (I think it's local, that's what I was told), and definitely nothing to write home about.  They did have some decent draft beer options but no one in my group of 10 said they would come back.  Try another ""local"" joint if you have an option.",Negative693NojJB0bumXlGjuFZ9SQ,"Service sucked big time on Monday, June 9, at the Primanti's in Market Square. It took more than a half hour for my wife to get a cheese steak and the place wasn't even crowded. Missed the first inning of the Pirates game as a result. Boo!",Negative6ojbU8xvUBRfM5wAAoYbFA,"My friend and I stumbled in here during a road trip to Maryland.  I'm so glad we did.  I had never heard of the place before and we went there because the breakfast place around the corner hadn't even taken our drink order after 20 min of being seated. It was morning and there really wasn't much open in the area.  We weren't sure we wanted lunch food that early, but we didn't really have a choice.  Boy, am I glad we did! It was fantastic! No hype, no frills just good-a** food! Fried egg on my sandwich? Yes please! We weren't even that hungry and both my friend and I devoured our sandwiches!  And out of respect to the sandwich and sandwich makers, didn't leave a bit behind! We didn't have to eat for the next 48 hours, however haha. Just coleslaw and fries on a sandwich, what's the big deal?  Sometimes the simple things really are the best.  Now I have a reason to go back to Pittsburg!",PositiveaLnPJiSq80Ft-3cFnCkdSg,Highly disappointing. While sandwich is unique it was totally over cooked and under seasoned. No flavor,NegativeyD1FDEOT4mg0xSmW94FodA,"I found the sandwich I ate at Primanti Bros to be quite tasty!  As others have mentioned, the signature toppings of cole slaw (which I normally loathe, but, in this case, loved!), french fries and cheese accompany any of your ""meat"" choices for a sandwich.  The menu is limited, and there are no frills or false pretenses here.  I would definitely eat here again!  I had the fish and cheese sandwich, and it was outstanding!  I can't give the place 5 stars, because it didn't completely wow me, and the others in my party were a little disappointed.  I think they may have just made bad choices for their ""meat"" (kielbasa and the Pittsburgher), but I doubt I could get them to try it again.  But hey for only a little over $6 per sandwich, can one really complain?  Delicious!  I'll go back without 'em.  ;)  Not a lot of tables, and not even sure it's air conditioned, so don't bring your fancy clothes or your roaming toddler.  ;)",ObjectiveuO_kzYob9_QMP__UR43WUA,"So an honest review.  Bland.  Service good prices cheap but food very bland and pre made.  I ordered the new black bean burger sandwich.  Bread not toasted, burger tasted a lot like my morning star black bean burger that I get frozen.  Coleslaw was a lot better with the hot sauce I smothered on it.  The best part was by far the fries which weren't all that great.  I am glad that those were home made.  I picked all the bread off ate mostly the fries and was not very impressed.  The beer makes everything tastes better so order at least two beers before eating.  I'm not a big foodie but I like my food taste better.  I still ate because I was hungry and it's not uneatable, just bland and kinda of boring.  It's still a must do in Pitts so go ahead and do it at least once, but skip the rest of your stay.",NegativeRHNYzFVfL8vXRn1TxIcSPg,I always try to hit this location when I'm in town. Great staff menu is solid & a Pittsburgh tradition.,PositivevG5hz2M-sFOH12QugckG7w,Great food overall at all locations! Go to another location to eat though. The Market Square location has the most horrible service I've ever experienced. Horrible!,NegativeibUjX1Nlu3-baJV5vvFtBA,"i guess if you are in Pittsburgh and you want to do Pittsburgh things you have to grab a Primanti Bros sandwich but it isn't that good of a sandwich. Pittsburgh is loaded with great places to eat.  you can certainly do better.  having said that, i  totally get grabbing a Primanti Bros if you are in Pitt.",Negativec3jNJjvOxd7tyLMi3rb2UA,"I was brought here by some natives for some Pittsburgh gastroculture.   I had a Pittsburgh-Burgh cheesesteak, and was greeted by a gargantuan sandwich that I was to learn had both fries and cole slaw IN the sandwich.   Interesting!   Ultimately, a little too filling, but well done and with excellent service.",PositivemlhM-uUhOgEJRmeq6XZAbw,"This is my go-to place after a Pirate game to wait out the traffic. When it isn't busy the service is great and you can get a quick, cheap bite to eat. Always great to sit outside as well.",PositiveEZ1s82asALvzh29K9uKwjA,"I was recommended here by a friend as a place to cross off the Pittsburgh ""bucket list"". I ended up getting the Pittsburger - it met my expectations, which was above average to begin with. I'd definitely come back here again.",PositiveXmb64a6Ex49vKBQ43UMdoA,Absolutely horrible! Frozen meat patty with a dog food like taste and texture on the P'burgher. Seriously how does this place survive? Read Sarah F. review as it mirrored or experience at the strip district location. Will never return to any location!,Negativekk4xhFgH3d5uhQTT_ioPcg,"First time going...and I LOVED IT! Great service, tasty food, and a ""hometown"" ambiance. I'm not from Pittsburgh, but this place definitely made me feel at home. The portions are huge! My only regret is that I didn't try to split a meal w/ my girlfriend.",PositiveF71ZX9nLFf2DCaYEkR7YjQ,"Service was bad. Server walked away before we were done ordering and then when someone got her attention she had to return 5 minutes later to re clarify which it was wrong. We didn't see her for a good 20 minutes and had to go up to the bar for refills. She did take one of our cups to refill it, sat it on the bar and left it there for 10 minutes, when we finally saw her again had to ask her to grab it off the bar. Highly disappointing Philly cheesesteak!! The meat in it is that of a frozen Salisbury steak TV dinner!! French fries were good.",NegativePd-6FtIgiMJPMShluitLog,"Oh yeah! After some difficulties in securing dinner, my dad and I found ourselves at one of the billion Primanti's locations for a quick feast. I haven't ever been happier to see Angry Orchard on the menu, and once my dad was settled with a Blue Moon, we got to business - kielbasa for me, Angus steak for him, and fried pickles to start. The pickles were 5 star deliciousness! I just loved them, and may have pushed my dad out of the way to claim the last as my own. The sandwiches were yummy too! I loved the kielbasa itself, but had to hunt to find the promised cheese. The coleslaw is really excellent - tangy and light, and I personally like it a lot on the sandwich itself. The fries were less excellent. I don't know if they would have been better on the side rather than on the sandwich, but they were kind of cold, soggy, and unsalted. Didn't stop me from eating them, though. I think that if the fries were better, this would be a 4 star establishment.",Objective#NAME?,"Good prices and a Pittsburgh Classic. Kolbassi sandwich with Fries? Yum. Spicy rub pickles? Yum. Good beer, too. Nice outside seating but beware the pigeons, sit-down and counter service,",PositiveiWkKeZu8LPSHIdstLQyOYg,A Pittsburgh staple! Highly recommend to out-of-towners & Pittsburghers alike. Add hot sauce! It's amazing! I wish they would put one in the Pittsburgh Airport!,Positivekas5Y5iluBD8cG6mAzM1zA,I had a cheeseburger and it was decent. I'm not a fan of coleslaw which made the burger a little dry after taking it off. I'll have to give something else a try the next time I am in town.,Objectiveg-ocYMmqBCEeBvF4pQ0zIQ,"First Yelp review ever. Not impressed at all! 45% bread, 25% cole slaw, 25% fries, and 5% meat. The bread is cold and not grilled or warmed on the grill. Avoid and eat else where. Don't even think about the wings (dry and no flavor).",Negative