review_id,sentence,sentimentFNnXv7iKidwPhu7dRgddsg,Boy do I miss Primate Bros.  I remember going there when the packing district was coming alive at 3 and 4 a.m.  We were coming back from a night of being out 'n about with friends (this was in high school/college summers in the mid-70's).  We would order wild concoction in sandwiches with french fries IN them.  I liked the place so much I bought and wore proudly one of their T-shirts...but alas...left it with a native friend (she also liked it alot) in Koh Samui Thailand.,PositiveodTD3ohAIP-i-hHqcUkd3A,"Pastrami and cole slaw and fries, oh my! 
I'd heard about all the hype and this place lived up to it.

To have it all piled up into one sando is a midnighter's ""raid the fridge"" dream. A nice combo of pastrami & corned beef, a layer of good cole slaw and topped off with some golden fries makes for one tasty sandwich. Had it been after last call somewhere I'm sure a fried egg on top would have been thrown into the mix.

Couple this with a 23 oz. beer for $2.50 and what more could you ask for. Actually only minus 1/2 star because of their chili, other than that, scarf up people.",Positiveezv4wHeJM9w49A_D7dwJFQ,"JR H and I seemed to miss each other this weekend in Pitt. Always going to the same place yet not really.  Our little group, which inlcuded the parents(yeah i still get free food) went to the Market Square location. The location is nice. Market Square is a nice area. Brick inlaid street. Clsoe to 3 river point park and my hotel.
This restaurant is something one must do when in town. It was also on Food Network, and man times reviewed here at Yelp. The food is pretty good. Where else can you get a ""value meal"" between to slices of bread. The sandwiches for those just learning. Your choice of meat with some nice itailian deli selections, kolbassi(haven't seen that  on a menu i around SF), or fish, below a nice bed of fresh made and not too dripping wet coleslaw. Fries with that? Heck yes and they sit right on top.  All on a Itialian sliced bread. The have a daily beer special 24oz beer for about  $2.50. 
Now this place and the food is fun. The food gets better tasting as the hours get late on a night out. Think how great a bacon wrapped dog is after ""dancing"" the night away. You know that fun 3 step dance. Raise beer, tip glass, put back down. The kind of food and place you want to head when you cheat on your diet, watch some footbal and chat up with the locals.
The staff was very good. The food came quick. Best of all. It had no kick back later or the next day.",Positive8OSx2MkHkza_JrMTjAhmXQ,"God I miss this place. Best sandwiches in the Burgh. If you are down near the Strip, you have got to swing by here. Get the pastrami or roast beef and do not ask for the slaw or fries on the side. It's all on there for a purpose and it is a gloriously messy sandwich.",Positive8jF3dSmg65hZusjXPmJEeQ,"Whenever I happen to be in Pittsburgh, I would come by to this great place for lunch.

The sandwiches are HOT! Whether it is steak & cheese, or fish & cheese, or even hot sausages and cheese, man, it is ALL good. With literally a pile of tasty french fries and sauerkraut like cold slaw in the middle, the sandwich is huge, all for under $6. Add a local Yuengling beer (America's oldest and best brewery) if you like.

If the sandwich is too much for you to handle, take a stroll at the tri-state park.

The place is usually very busy at lunch time, with waitresses hustling around, wearing store T-shirt knotted around the waist, dashing in and out (since they do have outdoor tables). On the back of their T's, there is a vivid picture of the gigantic sandwich. When they turn around, you just cannot help notice their boobs too. I guess the sandwiches are as attractive as nice boobs :-)

A drooling place. Period.",Positive0y_hVS6RL0lOftaNap3GwA,"We made a trip to Pittsburgh a month back and a friend of mine insisted that we get a sandwich from Primanti's.  It was everything I'd hoped for.  I had a roast beef.  It was topped with slaw and fries and I threw a little hot sauce in there.

Wash it down with an Iron City.",Positive23qKZlXJNmf7K3-D-PfeBA,Hot Pastrami + cheese + tomatoes + onion + cole slaw + french fries on thick crusty bread = One TallBadAssGreasyMuthaFukinGood Sandwich... :D,Positiveujd1wLDjeNl4oJSAM92QFg,"Kosher Pigswich with Dickfries and Ballzslaw!!!

Ladies and Gents, to comprehend what I am about to lay upon you I feel it's only right that I paint a picture of the womb from whence it came.
 
Welcome to Da Burgh, Ahhrn City --An old east coast city in Southwestern Pennsylvania, situated on the hills and valleys carved out by the Allegheny, Ohio, and Monongahela.  It rains a good deal here.  The city was built by many Eastern Europeans, some Italian, and some German immigrants who worked their asses off in the steel mills years ago.  Currently, Pittsburgh is much less blue-collar, but it still maintains much of rough blue-collar charm.  People here are genuine, love their football, beer, cigarettes (Marlboros and Camels not Parliament Lights), and facial hair (usually unkempt ones with neck beardage or the cookie duster mustaches often popular with middle-aged men with last names ending in ""ski"".)

Only out of a city such as Pittsburgh, could the Primanti Bros. Sandwich become a legendary food.

A Primanti Bros. Sandwich starts with thick slice of homemade bread, then the usual suspects of meats, cheeses, french fries are put on top, and then sweet & sour slaw is slung on top of that, and finally a tomato, and another piece of thick homemade bread.  The entire creation is plopped down flimsy piece of cooking parchment and shoved across the counter your way.  It's a huge toppling sloppy mess.  The only way to fit the damn thing in your mug is too smash it down before you bite in.  Whatever your modus operandi for eating a Primanti, there just ain't a way to eat it with dignity and still eat it right.

If you're having trouble visualizing this, check out their website. Besides their city menu has the #2 best seller indicated and yet oddly enough absolutely no mention whatsoever of the #1 or #3? primantibrothers.com

The true yinzer sandwich option that I recommend is the Kolbassi and Cheese.  The Kolbassi is split open and dropped into the fryer.  Yes, a deep fried sausage topped with cheese, fries, and slaw.  The grease just glistening from the singed flesh as it absorbs into the thick white bread (dignity is overrated anyway). Make sure yinz warsh it dahn wit ah cold ahhrn city, en'at.  (translation: Make sure you wash it down with a cold Iron City Beer and that.)

Primanti Bros. is definitely not diet food, but most definitely a 100% genuine Pittsburgh food.  It is disgusting in all the right ways.

I leave you with the apt lyrics of South Carey. ""Where they don't pour steel, but the kids are real. But why do they all have beards (beers)? It's Pittsburgh, Go Steelers Pittsburgh.""",PositivefkGwmAU4A9CF5-Tc3_Bckw,"Hey a sandwich with the fries and slaw inside served on a wax paper sheet and tasty (maybe a little bland, may have not chosen the best type) but would go back in a second.",Positive3MDkxkxv63S6pvViWV1yqw,"Here's how you can make your own Primanti Bros Sandwich at home:

Take two slices of Italian Bread, between them, mash together bland cole slaw, fries, some assorted meat, tomatoes. And at your fingertips is Pitt's pride and joy.  I'm not from here, so maybe I don't share the love. We weren't really drunk when we were eating here, and it was in the middle of the day. 

The service was pretty slow, but when our order was taken, the sandwich came out very fast.

It was a good sandwich in terms of having really hot meat, and cold tomatoes and cole slaw, but I didn't think its as tasty as it could have been.

I think the bread should be buttered and toasted/grilled texas toast, and they should use seasoned fries. Use some sweet North Carolina style Cole slaw. 
I came, I saw, and I conquered, but I'm giving it back. I probably won't be back ever again.",NegativeR4-UPl8ZHvDfCeIg5dN2EQ,"One night I was watching the Travel channel, they had a show called Top 10 Places to Pig Out.  Of course I paying attention and taking notes :)  When they mentioned Primanti's and Pittsburgh I was like Yes! I'm there!  I could not wait to get my hands on this giant sammich of all sammiches.  My only regret is that I couldn't get it with a Yeungling :( All the more reason to come back!  Ok, so I went here with my host and we decided to strategize.  I got the capicola ham with provolone and he got the steak and cheese.  We got two sammiches and two cokes for $16, what a deal! We were supposed to share but ended up downing our own sammiches. I forgot to ask if the coleslaw was sweet before I ordered so I was a little worried, not a fan of sweet coleslaw.  Luckily, it was great! 
Here's the nitty gritty.  The sandwich bread is two thick slices of soft, white italian bread.  They put at least half a pound of meat on it, plenty of cheese, tomatoes, and a fresh coleslaw (not the mayonaissey type that I was expecting).  It's more like a marinated shredded cabbage, the marinade is tangy and vinegary.  The piece de resistance is that the sandwich also contains a huge mound of fries right in the middle.  The fries taste fresh, reminiscent of boardwalk fries back in the day, only better.  At the table they had ketchup, mustard and apple cider vinegar!  Any one from MD would appreciate that ;-)  All I needed was Old Bay seasoning and it woulda been heaven.  Maybe next time I'll take that in my purse...ssshh! Needless to say I devoured this bad boy and desperately needed a nap afterwards.    I came. I saw. I ate.

p.s. You can get it topped with a fried egg! I didn't see that on the menu until I was leaving! doh! next time!",PositiverKoR1ZDz9quzZeokzlvUeg,"I read about this place in the book titled ""1000 Places to See or Do in the US"" and decided to go here when I was at a conference in Pittsburgh. If you are into plates this is not the place for you. Wax paper, which actually is a good idea if you don't want to do dishes...which I could become a convert to wax paper any day now, is what your meal is served on. HUGE sandwiches...I MEAN HUMONGOUS. They put everything on. Fries, meat, slaw, all together between two pieces of bread. Definitely worth the experience for a non Pittsburgh person. 

Upside: Quick prep of food. If you want a semi fast food place where you sit down and actually take time to eat, you can order and eat and be out relatively quick. Prices are great! 
Downside: It was packed during lunch and my buddies and I were crammed in. If you have a disability it will be hard to maneuver during peak times.",Positive31OVrWBawjbTj4PkVIKzUg,"I must admit that not being from Pittsburgh, I walked into this place with very different expectations for what a ""cheesesteak"" sandwich constituted. Having said that, while the inclusion of an enormous amount of fries and coleslaw on the sandwich was great, the tiny piece of beef ""patty"" that can only be described as something they use as a weight watchers/jenny craig portion leaves much to be desired. I honestly felt like I was eating some sort of vegetarian sandwich with a tiny piece of shriveled up beef patty lost somewhere in between the enormous slices of Italian bread.

On the plus side, the Oakland location does have a pretty sweet deal for after 10pm, where a sandwich and drink was 3 or 4 bucks.",NegativetRsBB0iiK2Z6UKAcy4lIUw,"I was out of town in Pittsburgh, and I was told this was the place to go to get the PA experience.  The meal started off pretty well with $2 Yuenglings and amazing chili, cheese, sour cream and bacon fries.  However, things took a turn for the worse when the famous sandwiches came out.  Two of us had the turkey and one had the colossal fish.  I thought the turkey was slimy and tasted weird.  The fries added almost no flavor to the sandwich, and the cole slaw was gross.  The bread was terrible, and overall, the sandwich made me nauseous.  Totally not worth it, unless you just go for the fries and drinks.",NegativeKixOPtxntKUgZizQ3FFkkQ,"My bf is a Pittsburgh native.  I remember the first time we had Primanti's from Lucky's in Chicago.  I served everyone their Primanti's in my living room, dodging the Terrible Towels as the Steeler's game pushed on... and I stared at mine, wondering how the heck people can possibly eat this heaping, gross, mass of meat, slaw and fries.  I took mine apart and made a nice little buffet across 2 plates and ate it that way.  

THEN I took my first trip to Pittsburgh, took a chance on the real deal... and boy oh boy did I become a Primanti's lover!  Everytime we go to Pittsburgh, we hit Primanti's for lunch.  We have to!!  I never want to start a trip to Pgh out without hitting Primanti's... pronto!  =)  

Primanti's is a great little spot to grab lunch, dinner, and even a mid-day snack.  I love the fact that this place is always jammed full of people.  Their food is well worth the wait and the effort it takes to tackle a table before someone else does.  The murals on the wall never get old, and it's great for one person or the whole family.  I can't wait to go next week for the start of my holiday season!",Positive3kcIc50X748J1PPljv-1zg,"i've always been and always will be a big fan and follower of lineage, tradition, and history.  primanti is living tradition and history.  no matter what, when in the burgh, you gotta have a primanti sandwich.

every town makes there own sandwich differently, their own hotdog differently, their own hamburger differently, their own barbeque, and their own pizza differently.  primanti is known for its pile of meat, stacked with coleslaw and fries on top, sandwiched between two pieces of italian bread.

these sandwiches are HUGE.  honestly i can't eat more than half of one because they are so filling.  this is a great place to satisfy your munchies.  

its a great place to come after you've finished your shopping in the strip.",PositivepywzplPJiZU0Med8aLZ-og,"I wanted ""authentic Pittsburgh food"" so I was taken here.  I have been spoiled by non-smoking restaurants for most of my life, so when I was taken to a Primanti-smoking-location and had to eat ASH with my food...I was already an unhappy camper.

The sandwiches were a novel idea adding both coleslaw and fries.  This reminded me of a Brazilian hot-dog.  Nevertheless, the Hot Sausage and Cheese sandwich I ordered was netiher hot nor spicy.  The fries were average but the coleslaw  in the sandwich was crunchy and delicious.  If the meat was more tasty, I'm sure I would've given Primanti 4 stars.",ObjectiveK-7E-w_aF9hJtwOHIZ2CaQ,The sandwiches here are massive.  Whatever you order winds up between two pieces of bread which seems both wrong and logical.  Regardless it is a mighty fine sandwich.  I wish I could get one right now...,PositiveVtDm_rRY4mrZ7brabAvQVg,"This place is lengendary so naturally as a tourist - I had to go. I can sum it up in one word YUM!! Staff was friendly as we sat at the bar and watched the cook in action. I have never had a sandwich quite like that with a coleslaw like substance and fries on it, but I'd gladly eat it again. Lively fun place with people to match. Great for a quick casual bite.",PositivetVEjUAas66T-xgFX1RW-HQ,"Dude. A meal on Mancini Bros. bread. Not much to say, except I'll have to book more trips to Pittsburgh to eat here again! Definitely a good way to gear up for or finish a night of drinking. The cooks were hilarious and only added to the post debauchery atmosphere. The fries and slaw on the sandwich are something I will absolutely have again. Go. Do it. If you can.",PositiveEYeBhoQ1JUZ6YMbDBkoD4g,"I was a little skeptical at first because I hate cole slaw. But, I was told this is a must in Pittsburghian culture and so I braved it. YUM! These are some great sandwiches. I should have known to trust anyone who puts fries in between bread. Easy to eat meal for sure. The sandwiches are huge, so you could split it with a friend, if you have the same taste buds. Now, if only they had one of these in Chicago.

I'll be back if I'm ever in Pittsburgh again.",PositiveCQfvwGK9-KMfeiM0Q1phbw,"A Pittsburgh classic :) I can't say it's my favorite food, but you must try it, having coleslaw and fries in the sandwich!",PositivemaA79lmOvtpvEluBo5Dfmw,"If ewe don like Primanti's, yer a jag-off.

As much a Pittsburgh institution as the Stillers, Irn City, and Sophie Masloff.  Much like referring to Kleenex, to native yinzers, you just go and get a Primanti's.  No need for any further descriptives.  

The secret to the sandwich is the bread: thickly sliced Mancini's bread.  Rumor has it that Primanti's opened a location in Florida.  It didn't do very well because they weren't able to get the Mancini's.  There you go.  My favorite version of the Primanti's is the steak and cheese.  It's a beef patty and cheese (not sliced beef as in a cheese steak).  This is the only thing I will eat tabasco on.  Fresh, thick cut fries and mild vinegar based cole slaw.  Piled up perfection.

Only visit the Strip District location for the full effect.  The other locations pale in comparison.",Positiveh_VSXbMQIXVIzkBHdRasUQ,"Primanti's sandwiches pretty much sum up Pittsburgh in many ways:  big, over-the-top, tasteless, and unhealthy.  What more could you ask for? Unfortunately, this place is pretty dirty.  Make sure no flies land on your food.

It seems like Pittsburgh natives love this place, which is fine.  Its food certainly is unique.  However, if you're not from Pittsburgh, there's a good chance you'll walk away with a rather bland taste in your mouth.

By the way, do not pronounce the ""t"" in Primanti.  It really irks native Pittsburghers.  It's pronounced ""Primanny.""  Unfortunately, I learned this the hard way.",Negative9JWEzgTnOPjkNvVekQkI_Q,"As a visitor to Pittsburgh, I certainly can't claim to understand the nuances of the local culture.  But Primanti Bros., aside from being at the top of everyone's recommendation list for places to eat, just oozes personality, and to boot, it's a fun place to just chill and get a damn good meal.

The whole french-fries-and-coleslaw-stuffed-into-a-sandwich thing would only be gimmicky if it weren't freakin' delicious.  It's impossible to look cute and shove one of these things into your mouth at the same time... although perhaps that's the idea.

Now I just have to try all the locations and figure out which one is the best of the best.",PositiveGQlj1GTUmimhUtc1aV_ImA,"I had to go on my first trip to Pittsburgh after seeing it on the FoodNetwork. The employee recommended the corned beef. I got it to-go so I can eat out in Market Square since it was such a great day. I learned that by getting it to-go, they wrapped the sammich so tight that it flattened the bread to nothingness (see picture I posted). 

I was expecting a mayo based coleslaw, but it's vinegar based (which was better and better for you). Like others have said, the meat quantity is so small that it's a sidekick to the coleslaw and fries. I really liked the overall flavor. I just wished the meat, slaw, and fries were more in proportion to one another. (again, see picture). Having lived in NY/NJ, I'm used to the deli sandwiches where it's nothing but meat with two slices of bread. Nonetheless, I really enjoyed this piece of local PIT culture and that's what counts. For $6-8, you can't beat it when you're in Pittsburgh, esp. when y'uns warsh it down wit some Yeungling Ale.",PositiveNzBnmKUd28po0fXS4H-c-w,"Having heard from a co-worker originally from Pittsburgh to try PB and the fact that I am a french fry fanatic (see ""Last Meal on Earth"" on profile), I had to make a this a first priority when visiting Pittsburgh for my business trip.  

The friend that I was meeting for dinner had no objections to eating at PB.  This location is a no frills sports bar - plasma screen TVs on the wall, beers on tap, crinkly paper menus, and seat your own self kind of place.  I ordered the Pitts-Burgher Cheese Steak sandwich ($5.99 and #2 bestseller).  It consisted of a thin burger patty, cheese, coleslaw, tomato, a thick layer of french fries all in between 2 big slices of soft french bread.  

The sandwich came out on just the wrapper - no plates.  I was unsure of how to eat this sandwich that was considerably bigger than my mouth but I finished both halves in one sitting.  My friend was quite impressed by my gluttony especially for a petite person.  I highly recommend this sandwich for the portion, taste, and price.  

My friend ordered and swears by the Ragin Cajun chicken breast sandwich.  According to him, it's not too spicy.  He also ordered a beer from the tap served in the biggest beer glasses I've ever seen.  If you're visiting Pittsburgh, I would suggest that you too, make PB a priority.",PositiveHpVqcjWBEbzyogczBGV5sg,"I was in Pittsburgh for the 4th of July weekend to check out their fireworks and I visited the Market Sq. location on the 4th, place wasn't really packed when I arrived. I needed to feed myself, my wife and my two kids. I ordered a hot sausage and cheese for myself, a black angus top sirlion and cheese for the wife and split a order of 6 chicken fingers for the kids (it comes with fries, what a deal!). After I placed my order I waited by the bar and unfortunately it was when the death of Steve Mcnair started to air :-(. The bar quickly filled up after I placed my order. The sandwiches took a little while to prepare and not as quick as I've heard they are. I got my order and in my usual fashion I checked it. No chicken finger and fries....bummer. I go back to the cashier/bartender/cook and asked her for my order who asks the cook where it is and he shrugs like ""I dunno"" so , she grabs some new chicken fingers and tosses them into the fryer so now I have to wait even longer for my food. I was planning to take it to go and eat at my hotel because there was no free parking out front. My hotel is by the airport so I wanted the sandwiches to be fresh as possible so that I can get the full experience. The chicken fingers took even longer to prepare so I am waiting and hoping my food doesn't get cold. Finally, after awhile watching the news my order is ready and I dash out and drive back to my hotel. First let me say the kids INHALED the chicken fingers like I never seen them do before and they have tried chicken fingers everywhere. The fries they didn't care for so much. I ate half my sandwich which was no longer hot and it wasn't bad, my wife didn't really care for hers since the amount of steak was skimpy. We would definitely try Primanti's again just not the ones we got this time and we will eat them at the location so that they are fresh as another complaint my wife had was the ingredients didn't seem fresh. I can cross Primanti's off my list of things to do in the da 'burgh. Now if I can only get over my fear of heights and ride those inclines.",PositiveQdCOoIZsydm1_BnfkDuIIQ,"The food was just OK. Soggy french fries on a greasy cheese steak pattie.  The service was awful, noise, and not helpful for a newcomer to Primantis and Pittsburgh.",NegativeGxMB4dzMxvin3lk2szuGpQ,"don't come here if you are looking to have a light meal. they stuff every sandwich full of slaw, french fries and other condiments. this place is a staple in the area so i knew that i should visit the location. they have a special pburger sandwich which i guess is their most popular sandwich. they have cheap beer also. depending on what time you go here the surrounding area is either dead or filled with a lunchtime crowd. i suggest going during the day when there are more people around. at night time some shady people come out.",Objectivesnqrj3dTscwEYxZH5h-ypQ,Update.  Went to a different location.  Non-smoking location.  Got pastrami this time instead of the bland sausage.  Added a fried egg to the sandwich as well.  I forgot how huge this thing was.  I could only eat half.  I am now a fan of Primanti's.,PositiveFJCHb1vjLJuq3OrUSxyWVQ,"Stopped in here while passing through Pittsburgh without knowing anything about the city or this establishment. Like gnats, we were attracted to Primati because their neon sign was... pretty.... soooooo pretty!

Anyway, stopped in here and order the Pittsburgh cheesesteak which was quite tasty. We also got the Cajun chicken sandwich with cheese... because everything there comes with cheese. Everything. Need salt? Even that has cheese on it. It's kinda awesome.

Anyway, both sandwiches were quite tasty and with the fries on top... yummy.  Would definitely come back here next time I'm coming through Pittsburgh, hopefully for longer than a few hours.",Positive4ZqiP-bjbB8yCMGebOx00g,"We ate at Primanti Bros based on the reviews on Yelp, hoping to get a real taste of Pittsburgh. What I ordered was a sandwich labeled Pittsburgher Cheese Steak. What I got was an inedible slab of overcooked mystery meat, cole slaw, and mediocre fries, on white bread. The sandwich was very small, but I only ate 1/2 of it anyway, and I have a pretty big appetite. I recently ate a 20 oz cheeseburger at a local burger joint.

I was truly shocked. That was the worst meat that I have seen since Junior High School. We would have been much better off at Burger King. Luckily we had a nice lunch at Salim's to wash the taste of this junk of our mouths.",Negative1N0m1uky_RjMPBsrsH0LbQ,"Worst sandwich on Earth.
I'd rather eat a dead whore.
Please...never come here.",Negative