review_id,sentence,sentimenteX3kfbyPZOoQsdN9VahW4w,"Mert's you certainly captured my heart, soul...no way...but heart, yes ma'am! 

I ordered the Fried Chicken breast with Mac n Cheese & Collard Greens on the side. The chicken was tender and the fried chicken shell the perfect mix of crispy with the juicy chicken meat. The mac & cheese was so utterly delicious it nearly stole the show. It was so creamy. They have hot sauce on every table, a great sign that you're about to experience good soul food. Sure 'nuff, the meal did not disappoint. The cornbread was out of this world good. I was so full after all that food, dessert was out of the question but they had some really amazing looking cakes. 

Next time I'm in Charlotte I will definitely be making a pit stop!",Positive-BfiZy6CfG-zFFEyEn-35g,"Highly, highly overrated! I'm from Louisiana, so I'm a tough critic. I ordered Blackened Pork Chops and it was just okay. Also, we smelled like a grease kitchen for the rest of the day. Best advice is to dine outside! Best piece of lunch was the cornbread.",Objective8rIDd10kjI96TefrOMT2Fw,"Great place for lunch when you're craving soul food in the Queen City.

I came here with a coworker for lunch, and had the fried shrimp po boy and macaroni and cheese.  Runs for about $7ish dollars.  The mac and cheese was okay, nothing special, and the po boy was exactly what you would expect it to be.  The cornbread is good, but for some reason I still prefer Boston Market's..... ha.

All in all it was a satisfying lunch, but nothing that I would go crazy over.",Objective13LRnG7Wr9NgwMvaVjeVMw,"We went here while in downtown Charlotte.  It was pretty good soul food.  I had fried chicken, mac and cheese, and mashed potatoes, however the cornbread they brought the whole table was the best thing I had.  Our waitress was very nice and accommodating.  Eating outside was nice as well.  It was very affordable for a downtown spot too.  If you are looking for some good home cooking in the city, you should check out Mert's.",PositiveWmV46C-kmlhaFCFYiRrFeQ,"I love this little place. I went in there because it was next to the hotel I was staying at. I was very pleasantly surprised by the helpful staff and delicious and affordable food. The waitress gave me great recommendations and was very friendly.

I had the salmon cake which was so moist and flavor. Their homemade sauce added even more flavor to the already flavorful salmon cake (I just couldn't get enough of it). The vinegary collard greens had diced onion/tomato sprinkled on top. The corn bread was fluffy and sweet, and on the more moist side (although I have had better - in Boston's Oyster's House to be specific). The Okra & tomatoes was good, but I guess I'm just not a fan of the flavor of Okra, so I would have to say that was my least favorate item of my meal. The entire dinner was just over 10 bucks. Now my stomach is full and happy :)!",PositiveqMOUStQ3fIb4bLiF4wL1UQ,"This pIace earns points for (if nothing else) being open past 8pm on Sunday. I just moved uptown and was in the process of doing some unpacking when hunger struck. As I was unprepared to cook and uptown seems to become a ghost town embarrassingly early on Sunday nights I started walking, not even wanting pizza, towards Fuel thinking it the only place certain to be open. So imagine my surprise when I saw from across the street that Mert's was still open!
I have very little experience with soul food but always wanted to try the place. I expected to pay a bit more than I usually would for a quick dinner but figured it would be worth it to have something different for take-out that I could pick up quickly on foot. 
Price being my primary concern I ended up getting the shrimp po-boy and a side of mac and cheese. There were things that looked better but I ended up only paying about $7 and was very satisfied. Get the mac and cheese; it's delicious!",Objective48CkAH1Y4jEa1cFw01lfgA,OMG.  The best!  We love this place!  We visit a couple times per year on business trips to Charlotte.  Service is great and consisten (same folks year to year).  Fried chicken was THE BEST....unless of course you are talking homemade cakes.  We usually sneak a couple slices back to our hotel room.  WE LOVE THIS PLACE,PositiveV9W9kBJPjSvYmAOIzdFuFw,"I'm going to *try* to keep this brief.  First of all, I'm kind of surprised the reviews are just ""so-so"" for this place, because I was really happy with the whole experience.  I had the lamb chops, and they were well seasoned and cooked perfectly. I was chewing on the bones, which is not typical for me in public. The collard greens are comparable to my grandma's (rural Alabama). The mac and cheese tastes like it's homemade (not Boston Market, not Velveeta, but the real deal). I also tasted the okra and tomatoes and the yams -- everything was just right. 

Ever been to Je's in Newark? For the last 10 years I've been looking for a place that compares to it, and I finally found it at Mert's. Excellent service -- our waiter actually had real conversation with us and treated us so kindly. Same thing at check-out.  We WILL be back. I highly recommend this place.",Positive#NAME?,"Mert's has been around for some time now and they still remain the same in that it's all in what you order which will determine whether you're going to like them or not.  Some things are really good like the cornbread, soul rolls, and salmon cakes but some things are just ok like the mac n cheese, greens, and chicken.  The service is always pleasant and their dedicated patrons will keep them among the soul food favorites in Charlotte.",ObjectiveEd3b_Y9H00xWcv_tu_xI9g,"Awesome fried chicken.

I really wanted to go to Price's but since the conference I was attending ended pretty late, I had to get my chicken fix somewhere else and ended up at Mert's.

I got there around 8 and found the restaurant to be somewhat empty.  Rather than eating there, I decided I would have a better time eating back at my hotel since there wasn't much going on at the restaurant.  It wasn't until on the walk back I realized that the steam from the hot foods probably softened up the fried chicken!  I was prepared to be disappointed...

BUT the amazing thing was that the chicken leg quarter that I ordered was not only juicy, but the skin had somehow retain much of it's crispiness.  As I start to gnaw into the fried chicken, with each bite I was amazed at how flavorful it is.  Didn't need any sauce or anything, it was tasty as is.  Like I mentioned, the chicken is juicy.  Dark meat is always the way to go for me for fried chicken!

With the fried chicken, I also got to choose two sides, so I went for the yams and mac & cheese.  Lots of spices for the yams, and I like how it still retained its chunky form.  As for the mac & cheese, I only liked the part where the cheese had caramelized.  Not too special to me.

It also comes with this awesome cornbread and softened sweet butter.  Cornbread + butter is seriously one of the best combos.  I know butter is good with a lot of things, but when you have a tasty cornbread, butter just enhances it so well!

Even with it steaming in its own heat for around 10 minutes as I walked back to the hotel, the chicken was still awesome.  I can only imagine how great it would've been if I ate there!",PositiveNZ0xOZIWCSESJ-tJ-7OSlQ,"Super friendly service and very quick! Food was good (i had the southern sampler). Cornbread was A+
I just wish the ventilation was a little better inside, but if you don't mind smelling like fried food, then all around, this place is wonderful!! :-)",PositiveM3CESVOUBm1T3UvanCAB6g,"If only there wasn't a person growing inside me... I so wanted to eat everything on my plate, and could only cry to myself as I watched Andrew finish off the last morsels of yummy-ness. 

The cornbread: Warm, fresh, delicious.

The mac'n'cheese: How it should be - gooey cheesiness with a slightly crunchy top reminding you of how lovingly prepared it is.

The chopped pork: droooooooool.

Be prepared to be squished though, it's tight spaces and big, loud crowds enjoying their meal, so if you don't like being cozy, then stay outside.",Positive2fp8K3Efh1wRm7L8GNHr6g,"Visiting Charlotte and asked for recommendations for Soul food and we were sent to Mert's. And Mert's did not disappoint. 

The service was amazing friendly and warm like I was coming to their house. We came at 9pm on a Thursday, it closes at 930pm. But the waiter made sure we knew we didn't have to rush because there was over an hour of cleaning etc to do

Now let's talk about the food. About the amazingness of it. 
My girlfriend and I got two different things and shared. I'll list in order our favorites. 
1. Collard Greens- they were the best I've ever had. They were just done perfect.
2. Fried Catfish- it was cooked and breaded perfectly. 
3. Fried chicken- followed closely by the fried chicken, breaded light but perfectly.
Those 3 were my favorite after that the others were good but not as mind blowing. 
Solid mac n cheese, yams, okra and cornbread with whipped butter...mmmm..
My girlfriend got the salmon cakes they were the only thing that was a disappointment.  Not bad but they were whatever, we killed everything on the plates except the salmon cakes. 

They had a microbrew Carolina Blonde that was a solid beer. 

Overall from the service to the food it was a great experience. I'd recommend it for sure.",Positiveyrvhkk30VpXDNFubM5JyXw,"Amazing soul food in the heart of downtown Charlotte.  Fun atmosphere, warm and hospitable service. Generous portions. Everything was fantastic.",Positive_y_Zvkea_veryDEfCqtyNQ,"Cool, casual service and the home of probably the best cornbread I have ever had in my LIFE. In my view, you can't go wrong with Mert's. Happy eating!",PositiveDBOoC6WfUUmUDYYcf23zyA,"The waitress was very nice and the food was delicious.  I had the fried whiting, home fries and coleslaw.  The whiting had a few bones but cooked perfect and my husband asked me to please bring him a piece of red velvet cake back to Texas.  How's that for service?  Nice place and I will go back.",PositiveiroM7QBq-uGD8OzZ4ApavQ,"This place was amazing! It looks like a little dive-bar in the heart of downtown Charlotte, but once you walk in you know you're home! Everyone was super friendly and happy to explain anything on the menu or make recommendations. I had the boneless fried chicken (how do they make plain-ol' chicken taste SO incredible?!) and couldn't decided between coleslaw, mashed potatoes with gravy, or macaroni and cheese and the waitress suggested the two starches... I was sceptical but couldn't have been happier once my meal came. Oh, and be sure to start with the warm cornbread and honey butter!",Positiveu0m7mzYBJAMCnW1Z4okO8g,"Real stuff, all good, all tasty. Helpful, attentive  staff. Sixties and seventies Motown music.

Food: Good, authentic, clean, tasty.

Decor: Cool Southern folk art and celebrity photos

Service: Fun, informative, and friendly.",PositiveurrS2zfrUyGOg10q6qULBQ,"Stepped out of the International Trade Center and BAM!! there it was.  Soul food ??  I had to try it.  It did not disappoint.  They had a meat loaf special so I went for the meat loaf and a small salad.  It was very good, of course with lots of gravy.  I saved the last two bites to try with some ketchup; still very good.

Portions not giant sized but I got a full meal and wasn't sick afterwards.  Reasonably priced - looks like I will be BACK !!",Positiveg-GI78ng35EdCjv9CiuACg,"Collard Greens were some of the best I've had.  Fried chicken was yummy, but the quarter (breast & wing) was too big to pick up and eat with my fingers.  Doing the knife & fork thing took some of the joy out of having my way with this guilty pleasure.  Homey  comfort food in a warm, friendly environment.",PositiveZP8epYtmLA8wj4vGdcBiYw,"Not the healthiest menu, but our server was really friendly and energetic.  We went for dessert, and had some delicious slices of cake -- german chocolate and caramel!",PositiveB8GdHtK0S9tYPLKGxsR_Zg,"After moving out of Charlotte, Merts is one of the things I've found that I miss the most. The owners and staff are true examples of southern hospitality, and the food is to die for. Their fried chicken is amazing, collard greens are heavenly (only second-best to my mother's), and without-a-doubt the best cornbread you'll ever eat. The only thing you don't want is their barbecue (its really not at all like traditional NC barbecue). Prices are reasonable and there's rarely a wait. Ambiance is kind of like a dive, but everything is clean. If you've never been you must go!",PositiveRgIIQLeXOlx5dDrrVGn8gQ,"I didn't grow up eating southern cooking but I love fried chicken, biscuits and gravy, and banana pudding just as well. So needless to say I had high hopes for Mert's. 

I went with the buttermilk and herb chicken fingers which sounded incredible. They were about $11 and came with two sides. Overall they felt flat and had an overwhelming garlic taste that became too much after one or two (and I love garlic -fyi)  I don't think I could eat them again. The Mac n Cheese as my side was a saving grace. Wow-awesome! Cheesy-stringy deliciousness and I ate it right up. My other side was the mashed potatoes which tasted great at first bite but again became overwhelming fast. Perhaps if I went with a veggie side I would have felt better but the food was so rich I felt queasy by the end. My boyfriend ate my cornbread as I don't care for that myself, and he liked it quite a bit. 

I had a bite of my boyfriends steak and eggs which were way overcooked and the steak was literally coated with grease - definitely not my type of thing. He said it was pretty average if a bit overcooked for him as well. 

I thought for the food quality it was a bit overpriced (but pretty standard for the area) and overall I just felt like everything was too salty, greasy, and rich for my own taste buds. Now I know you're probably saying well look what you ordered and perhaps that is true, but I have had fried chicken and mashed potatoes that felt decadent yet somehow less like my mouth was taking a grease bath.  If I went again I would order something MUCH lighter...lesson learned. 

On a positive note the service was fast and friendly and the restaurant itself has a lot of memorabilia that makes for interesting conversation pieces. So for me Mert's is just ok.",Objective7ed-UE6SzUun4g8SvOirVw,"One whiff of the food outside and you are ready to get on the inside.  Their food is off the chain!  Had chicken wings and collard greens.  Food for the soul.....um um good!  Red velvet cake again honey?  Oh well, let's head in for milk and cake.  We will be back!",PositiveTIcp98nCAd3kYS6gn40NeA,"I give Mert's a high three stars for my first visit. It definitely delivered on my craving for a buttery, salty hot meal. Oh, and some cheese.

The hubs and I rolled up on a Saturday around 2:30 p.m., fearing that no Uptown kitchen is open at such an in-between hour. Au contraire. Mert's was packed. Inside this low-ceilinged nook with couple dozen tables, colorful accents and storied photographs lining the walls, we found couples, families and friends of all ages going to town on some comfort food.

I had the Carolina chopped BBQ, swimming in a sweet, ""secret"" sauce. Served in a side-dish bowl, the Q portion left plenty of room for gooey mac and cheese and a substantial serving of collard greens with the right amount of tang. The hubs had the lowcountry omelette, which was OK for him; he said he'd go for something more fried and/or savory next time (atta boy).

We shared an appetizer of fried green tomatoes--tasty though a tad too bready and lukewarm upon arrival. The app came out after our entrees, but honestly when you've come to indulge in this kind of hearty goodness, does it matter?

And then there was the cornbread. There was a wait for it. Our server was repeatedly apologetic. But oh, was it worth it.

Our server was so very friendly and kept us happy with regular check-ins and refills on sweet tea. My only random nit was the vinyl table covering. I trust it's clean, but there's something kinda sticky about those things still. Otherwise, Mert's is a good-for-all destination for a casual feast of stick-to-your-ribs Southern cookin'.",ObjectiveTdh7kBfOCdwt9HECE_icrA,Loved the ambience and the staff.  The food was alright.  I grew up on southern cooking so I'm tough to please.  The one thing I will tell you is that their braised cabbage is THE BEST I've ever had.  Get three orders of it and make it your meal.,ObjectiveG9z-zqNQwd3sMaseRC1DvQ,"This is the only restaurant I had the chance to visit when I was in Charlotte last weekend and I was not disappointed.  I was warned that it is a hole in the wall, but it's not.  Just a casual restaurant.

We arrived around 2pm on a Saturday and were quickly seated.  After ordering, our food arrived about 10 minutes later.  I had the fried chicken with mac n cheese and greens.  And because I'm greedy and have no shame I also got a side of mashed taters (just so I could try them).

I really enjoyed my food.  It was hot and delicious.  The mac n cheese was very cheesy and satisfying.  The mashed taters were lumpy like I like it.  And the cornbread was good too.  A nice little loaf with some creamy, sweet butter.

I think my meal was about 10 bucks with a drink.   My only complaint is that the portions were kinda small.  Maybe I'm just used to bigger portions in Atlanta, but I could have enjoyed 1/4 more food.

The service was fast and friendly.",PositivekXTHrCx1UfDA4xVdYf3Jfg,"You get a lot of food - for a very good price.  Meal starts of with giant steaming mini cornbreads.  Order an entree and get choice of two sides (mac and cheese, potatoes, fries etc).  

Fried chicken was great.  Sides were somewhat disappointing.  Cornbread was amazing!",PositivevygbzMq5ioephKBwo3mVBg,"After taking the Charlotte Symphony audition and being heartlessly cast out in the first round, a friend and I set up camp at Mert's for some good ole fashioned commiserating.  It's ideally located right across the street from the theater, so as waves of depressed looking cellists streamed out once per hour, we were able to bring in some more friends to eat and drink our sorrows away.  We sat out on the patio as it was a lovely spring day, and stuffed ourselves with the great food here.  I had the fried tilapia (special of the day) with greens and yams.  It was great, flavorful and well proportioned.  My friend had the fried chicken with mac and cheese and he was raving about it too.  To polish off the meal we split some sort of caramely cake that was heavenly.  They have a bunch of great looking cakes on the counter inside, and I only hope to come back to Charlotte soon to try another!

Service was very friendly.  Great experience overall.",Positive0u4JC0HFRVRhehyur3_fyA,"In my opinion EPIC FAIL ...... I'm from Charlotte and my first time going there was last week and boy was i not impressed. I guess when soul food come to my mind i think of greatness because I'm from the south, it could be a lot better.",Negative_SERZTtsxIOBn0VrJln3JA,People keep suggesting macs speed shop and finally someone said try merts. Our sever Nia was a doll. Very helpful w menu choices. Their cornbread is to DIE for. As are there ribs. My pork chop was a little dry but still quite tasty! Love you NIA!!!,Positive8VoKFw_2TTMTLFc7xWjqmQ,"Excellent fried chicken, mac and cheese, collards, green beans, yams, and sweet potato cake and it's priced right too!",PositiveasV7R-Xy9zrwITqZf_poLg,"As much of a fan as I am of ""soul food,"" I just can't seem to find the right thing at Mert's. I have tried this restaurant twice and I have been underwhelmed both times. The prices seem to be a bit high given the quality and portions of the food. This most recent visit was my return visit to use my unused Groupon of which I had purchased two a year ago. I went with the lamb at the suggestion of the server and the parts of it that were not burnt to a crisp were truly delicious. The potato salad was really good, as was the mac and cheese. The yams weren't even close to those that my Mom makes, but hey..maybe I'm biased. Part of the downfall of Mert's for me is due to the fact that I have had Lawan's and they are on a completely different level. Mert's seems almost a bit commercial to me and it seems that maybe the food isn't prepared fresh (although I did have to wait a long time). 

I'm willing to give them another try, but I don't really want to pay for it so it's likely not going to happen. I love soul food and the people there were super friendly so I wish them continued success, however I'll be heading to Lawan's for my soul food fixes for now.",Objectivep531ZBgdfDBP5wE0m-H2fA,"Brief summary of our experience.  Service sucked ass big time!!  If it was purely based on service alone, it would have gotten a 1 star or 0 stars!!!  If review was based on food alone, it would have gotten 4 stars.  I decided to compromise and give them 3 stars.  

Our sour dining experience starts and ends with Sharon, our waitress.  Bottom line, she was very rude and she needs to be FIRED!!!

After we were seated, took about 5 minutes before she approached our table.  She then gave us 2 straws and did not even bother to greet us or introduce herself to us.  Then she turned her back to us before we could say anything and continued to flirt with the 2 guys in the table to the right of us.  We didn't even get a chance to ask for water.  About another 5 minutes goes by and finally we can order.  She takes our orders but throughout the entire time, we did not have her full attention, her mind was at that table!  After our orders were placed, we got our cornbread BUT she did not give us ANY utensils to eat it with.  I asked another waitress for utensils and she said she would get it for us, but she never did.  Basically, we weren't her table so she didn't want to help Sharon out.  I guess no camaraderie at this workplace.  In the meantime while we were waiting for our utensils, a party of 2 sat to the table to the left of us and they encountered the same issues with her.  They too were served their salad and cornbread without utensils.  We all had to wait at least 5 minutes if not more.  The only good thing about waiting was the table with the 2 guys to the right of us paid and left.  Now I thought she could focus more on us.  I was wrong!!  

She brings us our main dishes, fried chicken quarter and fried catfish with our sides being, mac & cheese, yams, okra with tomatoes, and collard greens.  We also ordered an appetizer and I couldn't believe our main dishes came BEFORE the appetizer.  In the end, we just took the appetizer off the bill because we finished out main courses and the appetizer never came in the interim.  Anyways, we STILL did not have our utensils.  I was pissed!!  We waited anywhere between 5-10 minutes before our utensils finally arrived.  By that time, out food was somewhat cold.  We ate our food ASAP and got the hell out of there!!  If you ever come here, don't get waited by her.  Another thing that irked me, a part of 3 ladies sat in the table to the right of us and she was definitely more friendly to them.  I won't speculate about anything but bottom line, she is a terrible waitress (definitely the bottom tier).

As for the food.  LOVED the fried chicken.  Batter wasn't thick at all.  Light and crispy and chicken was moist and tender.  The fried catfish was good as well.  Lightly battered and fried.  As for the sides, I personally do not like tomatoes and onions with my collard greens.  I prefer the smoke flavored ham collard greens.  If you like the sour/tart collar greens, then this is a place where you can get them.  The candid yams were good, but definitely not the best.  I couldn't put my taste buds on it, but the sugar they use is a little different and it doesn't seem that they used a lot of butter.  The mac & cheese was just okay, I prefer more than once type of cheese in my mac & cheese =P  (i'm just spoiled)  As for the food, I would recommend this place and I would come here again.

When we paid for our bill at the cashier's desk, that lady even knew that we received sub-par service.  She made some jokes to make us feel better about our dining experience.  I applaud her effort but what she needs to do is get rid of that waitress.",ObjectiveSxZ0ID5kY47yKUhkZsL92A,I love chicken and don't love ribs but I can say they have the best chicken and there ribs made me love ribs and the best thing were there collard greens they had a explosion of flavor I from Maryland and if i come back to Charlotte I'll  eat here everyday.,Positiveuap483sLWaB0u7w-Itbr_w,"My first review was 5 stars, but upon our second visit seven months later, I'm taking away two stars for one main reason -- gnats, or perhaps they are fruit flies.  Seeing them reminded me they were a bit of an issue during our first visit as well.  As soon as our food came out, they started floating around our plates. We put our bones on a plate on the table next to us in an effort to divert them. 

The food is still really good, and we appreciate the friendly service but it is a bit slow. As others have mentioned, the macaroni and cheese is quite yummy. I had blackened pork chops this time and they were well-seasoned but a tad bit dry. I'd still go back to Mert's, but if the gnats remain an issue on our next visit to Charlotte, that will probably be our last try.",Objective