review_id,sentence,sentimentsPJiBlLCqA7hhxySZ53QWQ,"Walking Uptown on a Sunday morning before church, my wife, daughter, and I stopped into Mert's.  Our waitress gave us the specials but said them so fast and with such apparent disinterest that neither my wife nor I understood any of what she said.  We ended up ordering one of the specials after seeing them on a chalkboard, only to find out after some more confusing, disinterested interaction with our waitress that they had stopped the special just minutes before (9:30am).  Don't know what that meant; did they run out of spinach?  Strange. We ended up with two other omelettes, the garden and the shrimp creole.  We had to ask three different waitresses for our accompanying toast and biscuit, and once we had our food, our waitress interrupted our prayer to ask if we needed ketchup (understandable, but most servers notice bowed heads, even if it's kinda awkward).  We did need the ketchup, but it didn't come until the end of our meal, and my wife's home fries were already cold.  My regular cup of coffee was mediocre, my shrimp creole omelette had 2 small shrimp inside (super disappointing, as they were tasty), making my $8 omelette mostly egg and tomato sauce, and my wife's toast was hard as a rock.

Obviously a rough experience for us this morning, but Mert's gets the second star because my wife loved her omelette (the garden), my biscuit and grits were pretty good, and they let us choose our seating (with a young child, this can be pretty important). We won't be back.",Negativek0-ZQHjsXNc3eUFzgXRAxg,"I've been here twice now (The first time my living social wouldn't load so we had to return, not that we were upset about that after our first great experience!) 

I think the service here is really hit or miss though, the first time we had great service, the second time a robotic like server who was actively RUDE to us after presenting our Living Social coupon. Like a toddler throwing a tantrum rude.  I understand that a lot of people might tip less when using a living social which is the pits, but we do not (and did not tip less despite her rudeness). Tip to restaurant owners: do not have a living social if your staff is going to be rude to your new customers... 

The food both times has been fantastic and the mac and cheese will keep us coming back despite the hit or miss service. We generally try to come during the week to avoid the crowds and that has worked so far for getting a table pretty quickly. Probably won't be a regular spot, but I wouldn't say that we'll never return.  

So, Food: 5/5, Service 2-3/5 (depending on your server) for an average of 3/5  or 4/5 on a good night.",ObjectiveGhdScYIpKj9MkI9bps19Ug,"Found this place through yelp because we were looking for southern comfort food and because we were stopping over in Charlotte for the day. Great place!! The food was excellent, every single member of our family agreed that we had a five star meal. Portions are very significant, and the pricing is good. Really wonderful service - friendly and down to earth server. Overall a great meal experience!",PositiveX7-KPMqqaDMn0r1bfxFY6g,"We chose to visit Mert's over going to a high-end chain because we wanted southern style cuisine, it was featured in travel guide from our hotel, and it got great reviews on Yelp.  I was in town earlier this month with my Mom and toddler while we visited my youngest brother who was working in nearby Kannapolis.  We were able to sit down right away and outdoors which was great.  However, we were highly disappointed by the food.  And, the experience is still memorable enough for me to write about now.

First, they were out of the fried green tomatoes which we wanted to try and we were actually there relatively early to when they opened.  The eggroll-style appetizer that was recommended instead was good but definitely within the same criteria of what we were looking for.  99% of the menu has fried food which my brother was most disappointed about since we chose the restaurant without too much input on his part.  My Mom and I decided to share the Mert's Famous Salmon Cakes.  While the size was decent, the taste was lacking and I felt it might be slightly under-cooked.  For our sides, we chose greens and the red beans both of which were just ok.  And, I will actually say the greens were my favorite food out of what I had if forced to choose.  My brother ordered the Shrimp Creole which just tasted like tomatoes and the shrimp was not popcorn style as described on the menu.  If it had tasted better I think my brother could have been happy that he found something not fried on the menu even though he had decided if he was going to make a diet exception that he was looking forward to it being popcorn shrimp.  After our waitress checked on us she said as a person from New Orleans had we asked her she would have told us that the Shrimp Creole is not on her recommendation list.  However, because other customers have enjoyed it she does not deter people form ordering it...tough position to be in I guess.  My brother also ordered the potato salad which was very heavy on the mustard and vinegar.  I'm accustomed to this style of potato salad but like I said it just had too much mustard for my liking.  My daughter had the chicken tenders from the kids menu which I found to be on the salty side but she seemed to enjoy them.  She also liked the okra and tomato and yams sides that we ordered for her.  The server was nice and she took decent care of us.  She forgot more coffee like my Mom requested but we also noticed that she seemed to have several tables.  

Overall I would say I'm not likely to give it another chance just because it seemed like we were in an area with a lot of choices which might have been a lot better.  I don't know if the chef was having off day or what but I just left very disappointed and felt bad that I was the primary person pushing to try Mert's during our brief trip to Charlotte.",NegativeszgPfoVRSORRFO3KzYEblw,"We've been on a search to find great southern soul food in Charlotte and this place is definitely at the top of the list so far. The location uptown on College next to the theatre was perfect. The service was excellent. The Perch was perfectly prepared. The baked macaroni and cheese was by far the best I have ever tasted. The Collard Greens, Black Eyed Peas, Cabbage and Oh Oh Oh that Corn Bread. The banana pudding had a surprising cake bottom and perfect texture. The ice tea was perfectly sweetened. The kids loved the chicken strips which looked buttermilk battered and very moist inside. Definitely worth the drive. There is no valet but you can park at the Holiday Inn garage and they will validate you.",PositiveeD_00utnX7pal4H1UnVLBQ,"Not the best soul good I've ever eaten. My collard greens mixed with mustards? Were tough. The fried chicken was standard not anything to rave about. Salmon cakes were good. Mac n cheese can pass for soul food. Yams were great! Corn bread mediocre, overall it was okay. Don't believe the hype, especially if you were brought up on Mamas soul food cooking.",Negative15eAUwg7oAEBKSi-AtcVFg,Hospitality is AMAZING!!! Visiting from California and this group of people here are all gems... The food Bomb!!! I seriously recommend this to any first timers... So happy we found this place!!!! You will not be disappointed!!!! :) Grits on point!!!,Positive2SpDQYvBtO3Ewh5L5UXUWw,"Went here for lunch with a friend yesterday and I've been freaking out about this restaurant since - to anyone who will listen. The staff & service: top notch. Such lovely waitstaff, so friendly and attentive.

The cornbread. I mean, so good.

For my main dish, I had the 4 veggie plate & chose Mashed Potatoes, Mac & Cheese, Okra & Tomatoes and Black-eyed Peas. The mac & cheese was life-changing. 

I thoroughly enjoyed the entire experience, and can't wait to bring my husband!",PositivehJmMP0b7M_zxIBkqWA4F-Q,"Breakfast food is excellent, so is the service and restaurant.",PositivehkaA_Yi6bSB7WxgcknraRg,"The atmosphere is amazing. Seriously...loved the decorations and the open kitchen.

The service was great. 

The food was...mmmm ok....my mom's soul food is better, but we couldn't quite pin down what the strange seasoning (not strange, bad...just strange, new) was in most every veggie dish. Maybe just a difference between Texas and Carolina cooking. 

The jumbo chicken wings were delicious. The fried green tomatoes made me want to watch Fried Green Tomatoes. 

Worth the price? Not sure...I've just had better soul food.",Objective2S4Sl28f1gmIji5NjEvTnA,"Service was friendly and down home flavored. Catfish, black eye peas and cabbage was well seasoned.. I also recommend the shrimp Creole. ..lots of green onions. I do not recommend the peach cobbler. That was like eating peach filling on bread.",PositiveEKx9e8voGkr2Uze0vahjDg,"After participating in the Charlotte heart walk, my friends and I went to Mert's for brunch. We knew the service probably wouldn't be that great but expected the food to make up for that. Big fail on that expectation. The collard greens were dry with no flavor and when someone on my party asked if she could exchange them for something else the waitress caught an attitude. Whenever we would ask for something it was almost like a mother may I situation. We didn't know if her reaction would be positive or negative. The manager seemed to not care about our situation and just left everything up to the waitress. After paying my bill I waited for my change that never came. I ended up asking for the manager to find out where the waitress went with my money. After the manager asked the waitress the waitress states she already gave me my change  after reminding her that she didn't give me anything she states oh then I have your money right here! It was in her pocket. Not sure how she could have forgotten that she owed me more than $10!! Especially since the tip was already included in the bill! Never going back and I will never recommend this place to anyone. Even if I do have a living social coupon!!",NegativeNT7C6Y0Z5oSWQyetK1_PjQ,"Mert's is a great find in downtown Charlotte.  The service is solid and the food is pretty good.  They have a beer and wine menu, but seem surprised when you order and adult beverage.

I took my servers suggestion and ordered beef ribs and fried fish.  It arrived along with sides of macaroni and cheese and black eyed peas.  The black eyes were some of the best I have ever had.  The beef ribs were really short ribs and were gristly and disappointing.

My husband opted for the special ""Tia's Chicken"" - chicken breaded with Parmesan and Italian seasoning topped with cream sauce.  This along with green beans and sweet potatoes made for a solid meal.  The chicken was good and a huge portion.

If back in Charlotte, we would definitely visit again.",PositiveXkLiuG_iB0teeGZ2h3PndQ,"Food here is gasp inducing. Some of the best soul food I've ever had. Even vegetarians will be pleased with the veggie sides platter. Collard greens off the hook. Candied acorn squash beats anything you ever had for Thanksgiving. Cheesy cauliflower was a bit underdone for my taste, still raw. Famous for their coconut cake, though after their huge slab of cornbread, you might need to hit the gym. Busy place for lunch, allow time. Service reflects the down home hospitality and warmth you'd want from a place selling comfort food. Come and feed your soul!",PositivejBxFPYTy4DDydkTxIEX9iA,This was my second and most likely last time attending this restaurant.  Reason for this statement is our waitress topped off my glass of water with water from a glass not a pitcher. Who fills a patrons glass like that?,NegativeWKixAT4S5Qv3MJv37SsVRw,"So it took three trips but I think I'm finally starting to become a fan of Merts.

My first visit was to pick up some catering for an event and I didn't get a chance to try anything. The second visit was a bust I ordered the chicken wings, cabbage and seasoned rice. Meh, I've had better everything. The chicken wings were just okay, and the cabbage and rice didn't have enough seasoning for my tastes. 

But this last visit was much better. 


We started with the Soul Rolls which come stuffed with chicken, rice, greens and black eye peas. They come topped with a spicy honey mustard sauce and were very good. They were crispy and packed with the filling. I'd recommend them. They also bring out some cornbread and that was definitely a highlight for me! It was warm and with some butter....it practically melts in your mouth. 

For my meal I had the pork chops, macaroni and cheese and mashed potatoes. I was impressed with the amount of food you get! Two juicy and well seasoned (yay!) pork chops blackened with delicious seasoning. Very good. For me, the sides were just okay again. I'm not sure what to get that will give me that ""amazing"" feel but I guess I'll keep trying....

I couldn't leave without trying some dessert so I ordered the strawberry cake. It was very very moist and delicious. 

So overall a much better visit this go round...I'll make my way back and give this place another try to see if they can officially win me over.",ObjectiveESz09NC118AOHCjIO2RTBw,"Soul food is ok...needs more seaoning and to be drained of grease. My entire rating is based off the customer service which was very rude and disrespectful for me as a customer. The wait was long and don't try to make reservations because they dont take on weekends.  The waitresses have bad attitudes and rush you when ordering. ...""imma take yall drink order and food order at the same time so who first?"" (Her exact words). I live in charlotte and have been here prior to this visit but will never return again. This was by far the worst soul food experience.",Negativerza37LGVdhG2q7wegmHYUQ,"I have had the pleasure of dining at Merts frequently over the past 15+ years. I've always been pleased with the food and service. Today....I had lunch here and ordered the Merts world famous Salmon Cakes. Sadly it appears the Salmon cakes are now Salmon BALLS. The portions appears to be cut in half. To whom it may concern.....we LOVE and adore this dish, however we are disappointed someone has decided to cheat us out of this delicious menu item. I hope my next visit will reveal that someone at Merts has had a change of Heart and their Soul has led them to serve the regular portion we have grown accustom to.....otherwise it may be my last visit. I will post a photo of what I received today.",Objective26pVASjHA1v4PvnXm4Ejvg,"Second time may be a charm but the first time was a complete failure. Thank you to management, Veronica in particular, for making a bad experience and almost the last experience one worth trying again. Salmon patties were very dry and not seasoned as described, potato salad or should we say mayonnaise salad was horrible. The yams were hard as if they were freshly cut and simply plated. The greens were soaked in garlic and had entirely too many stalks. The macaroni and cheese was tasty but in conjunction with everything else on our plates was room temperature. Tiger wood drinks were very tasty. Our server was not at all attentive to our needs. If she would have given us her name I would have very well called her out in this review. She did refill our drinks once and left the remaining glasses of lemonade and sweet tea on the table which implied.....self serve. My fiance absolutely loved the cornbread loaves and fried whiting. I detested the cornbread loaves. The initial one that I received had obviously been sitting out too long. It was cold. When I mentioned it to the waitress she informed me that she knew the loaves were left out and that a new batch would be up any minute. She did bring a fresh loaf but I was just flabbergasted that she would serve something she new shouldn't have been served. Overall, the experience was not very pleasing. However, our entire meal was comped by Veronica. She apologized for the service and invited us to come back. I must admit I am a little reluctant but because she heard our concerns we will give Mert's another try. I see their are multiple good reviews on here and hated to have to be the one to add a negative review. However, this was our experience.",NegativetJJMzZuJsbHk74QqC7EHkA,"I love this place.  Great price, great service, and awesome food.  The cornbread alone is worth the trip.   I also loved their fried chicken.  It's a bit noisy but that's because it is is full of happy diners.  Perfect spot for some casual Southern cooking.",PositiverZ3drp8SC-I2mZE64EqcDQ,"Are you hungry? Need to get some real savory food on your belly? Want to spend your money at a family owned restaurant?
Go to  Mert's Heart and Soul. Save room for dessert too!
We are visiting Charlotte and on the hunt for lunch downtown, yelpers you are the Best. You said this place was good and that's the truth. 
We ordered the red beans and rice, the lunch special, smoked pork chop, and the ribs appetizer. All were delicious.  We had iced tea for our beverages and peach cobbler for dessert. Samantha took care of us and is an ambassador for the establishment. She suggested we return and I said Thanksgiving time. Well, she said the owner closes the place on Thanksgiving day to serve the homeless.
Well I can only say this. I'm happy I had lunch there and if you try it I believe you will to.",PositiveDC9_7Knoxi2_Bv_CfUm9gg,"Great place to get soul food in the city. You will have to wait for a table on weekends. The wait staff is personable, but seem to be spread thin tending to the crowds of patrons that frequent the restaurant. They aren't the cleanest restaurant, the bathrooms are gross.",Objective65ROA2Kqq-EAPpSnAAiqNA,"I consider myself a bit of a soul food afficianado.  I've dined in soul food joints as far as Sylvia's in Harlem to Mary's in Mobile to Rosco's in LA.

Mert's is up there with the very best in soul food if the lunch I had was indicative.

The fried chicken was perfect!  Crispy batter (not too thick!) and juicy meat even on the breast.  The black-eyed peas were wonderful.  Perfect texture and smoky flavor.  

The Mac and Cheese was not the best I've ever had but mac and cheese is a bit like sex.  Even bad mac and cheese is pretty good.

Also, friendly efficient service (I had an early lunch) and great decor make this a big win!",Positivexd1LAw28dfoC7P2M-79j8w,"Food is awesome...Service is horrible.  I've been here many times and I keep coming back because of the awesome food.  However, every time I get a waitress who is short, no patience, in a hurry and just down right rude.  I've made up my mind that from now on, it will either be a plate to go or no tip for a sorry waitress.  If you can handle bad service then go cause the food is mouth watering.",Objective6XQiKRyYQVCK3qBMQcUsfg,"My favorite place to eat in Charlotte!  I swear they must sneak my grandmother down from heaven to work in the kitchen.  Great Southern food and lovely service.  They first time In was there they refused to serve my friend a salad, insisting on fresh southern veggies instead.  They were just kidding I think.",PositivefpbireDcPJrNw0nevDCmiA,"Gritty greens,everytime!...Need I say more?? Not what they use to be.",NegativeFDnT4elQMEkLZp5bRzREtA,"Mert's is Fantastic!  I have only been once, but the chicken was out of this world!!! Very cool atmosphere as well and frendly staff :) I will definitely be going back!!",PositivemGhLNz0mdPtATRjwKp9WSg,"1. CORNBREAD!
2. Amazing southern food, everything was equally delicious. Great place to feel at home and fix your craving for fried chicken and all things southern.

Their cakes look incredible too. Try and save room, I wasn't able to and regret not taking a piece to-go.",Positiveszsgj0eCFqgRlXTaOqeejg,Not a fan of anything here. I have tried the food here on several occassions and just dont see how people keep going there. Soul food with no soul.... thats my take on it.,NegativeNeSy_I4b-8IVfNFSDSlkaw,"Had a pretty good Groupon for this place- wife enjoyed the collards, fried chicken was finger licking good. Avoid the soup which was reaally a cup of broth. And steer clear of the Carolina Blond beer yuck. Loved our sassy southern waitress & the corn bread she brought us. We will be back.",Positive5NR7qtFtgHO4hTyC4XohNA,"Lunch comes with corn bread. I really enjoyed the bbq pork ribs, I highly recommend them! The ribs seemed to have been marinated in sauce over night then they add a vinaigrette type sauce over them which really packs on the flavor. If you have room for desert def get the banana cake, I am a banana pudding fanatic so the cake was right up my alley! The cake was very moist and smooth only 1 word could describe it- delicious! 
My only issue with this place is the fruit flies, sorry the little flies are a big problem. They need to fix that! If it wasn't for that I would've given 5/5 stars",PositivecCdFedf2e_Na60NIHkKRjw,"Food was decent, so was the service.  But the experience was deminished by the gnats flying around my food and table, and the waitress brushing it off  by telling me they came in from outside.  Yea. ( It was forty five degrees outside.). What make me realize that I am not returning was the couple in the corner that had their dog eating off  the floor.",NegativeV_Mabw3YICVXrW9fhWaPWA,"While visiting Charlotte, we wanted a place within walking distance from our hotel, The Hyatt House (fabulous place). We found the perfect restaurant on Yelp and quickly chose Mert's Heart & Soul. I love comfort food so this was my heaven. I had blackened pork chops with collards and mac&cheese. The mac&cheese was so delicious that I almost ordered a second round. My husband had the ribs and fried chicken combo with collards and mashed potatoes. I tasted his and it was yummy too. The cornbread loaves were scrumptious with the sweet butter. So not to be left hungry later when we returned to our hotel, we ordered the soul rolls & smoked turkey with beans & rice plus dessert- coconut cake, banana cake & caramel cake. All of the cakes were moist and full of flavor. 
Our waitress, Malika was great! She was funny, attentive and pointed us in the right direction with her recommendations. She made our dinner a complete success. We will definitely be visiting again and asking for Malika when we return.",PositiveQBAfDcy4lmsViDv_g9rOAw,Great place...excellent fried catfish.,PositiveGQReLc-dMnR4p_7nqC4G9g,"I used to live in Charlotte several years ago and whenever I return, I never miss a chance to go to my absolute favorite authentic comfort soul food restaurant.  I always order one of my favorite all-time meals: fried chicken thigh, mac & cheese and yams (beware - they're candied!) with a sweet tea.  You also get a mini-loaf of corn bread with honey butter.  Best meal ever!  

The waitstaff is always super casual and exude the ""southern charm"" you expect from a southern diner.  

Most people who live in Charlotte already know about Mert's (it has been there forever)... But if you're visiting Charlotte, do yourself a favor and stop in for a meal - you won't regret it!",PositiveA3QFoCA8doDWfFao2wtCig,"THANK YOU, Yelpers!! Maybe the best home cookin' I've eaten, and that covers a lot!  Beef spare ribs, fried chicken, shrimp & grits, salmon, collards, black eyed peas, Mac n cheese, slaw, and oh the cornbread that was served first!!  Seriously wanted a slice of one of the half doz cakes but, alas, no room. Guess we'll just have to come back.... And we sat next to a friendly lady sipping a beer in a Pilsner glass thru a straw; that's a first. Wish we could clone this place!",Positive2fUOdZm6lQN8fNl4U_5Myg,"Took my boyfriend for first time.  Waitress kept going outside smoking and smelled like ashtray upon returning to table.  Cornbread good.  Chicken good.  BBQ was disgusting and swimming in grease.  Potato salad was also old tasting and could not eat.  I was embarrassed that I had bragged to my bf about how good things were and then had such a terrible experience.   And it was over $30 for lunch.  Not worth the drive, parking, or time.",NegativezZZARbOdb3XYkzSyPIcszA,Slow service con this cold and wet Monday. The servers just didn't have it together and neither did the cooks as my chicken was seasonless and my Mac and cheese was cold. The only thing you can expect from Mert's is inconsistency.,Negative9kRLfEgh3nyVL4RToWoWIQ,"Great food, great prices, great staff, great atmosphere. Go here!  Had the breaded chicken special with okra and cabbage and it was amazing.  Tons of flavor and perfect portions!  Southern cookin at its finest.",PositiveHVVJkVfYuobwDkW1XHTBCQ,"I have been told this place was great for years. I finally went and in and was mad at myself for waiting so long before finally going in there. The food was fantastic. An easy atmosphere, a menu with a good variety. Definitely understand why it's always busy during lunch time. I highly recommend it.",PositiveoS7yNegSHhdbo9A38b-jzw,"I'm from NY. I only know what Southern cuisine entails from the Food Network Channel. Other than that, I have no concept of what things should taste like. Knowing I'd be in Charlotte for a short trip, I scouted out the food options in Downtown area and Mert's seemed to be the place where I could get my fix.

Knowing I had important business the next day, I couldn't take any chances with my stomach. My safety order of Buttermilk Fried Chicken Fingers ended up way too salty after a while. The sides of roasted potatoes and mac & cheese were just okay, nothing too mind blowing.

I wouldn't disregard this place completely after 1 visit since my party thought their orders were decent. Decent enough to put them into a food coma at 1:00 PM. Perhaps it was a bad day/I should've ordered something else.

Dat cornbread doe. Spot on.",Objective